Name;Name2;Producto;Teléfono;Ciudad;Correo Electrónico;Info;Sitio Web;Ubicación
MINERVA FOODS - ATHENA FOODS;;;575-7568888;CIENAGA DE ORO;carolina.montoya@athfoods.com;MINERVA FOODS - ATHENA FOODSMinerva Foods prima por la relación ética y transparente con los ganaderos, proveyendo nuestra principal materia prima. Buscamos siempre la proximidad con nuestros proveedores, compartiendo conocimientos técnicos y prácticos, y colocando a disposición herramientas que puedan contribuir al desarrollo de la ganadería. Aquí, el papel de proveedor/comprador da cada vez más espacio a las asociaciones, que buscan agregar calidad a lo largo de la cadena y benefician a todo el sistema.;http://www.athfoods.com;Pabellón: 03, Nivel: 01, Stand: 313
RAB GLOBAL SAS;RAB GLOBAL SAS;EQUIPOS VETERINARIOS, CONSUMIBLES, DILUYENTES, MEDICAMENTOS, HORMONALES Y TERAPEUTICOS PARA USO EN REPRODUCCION Y MEDICINA INTERNA PARA GRANDES Y PEQUEÑOS ANIMALES;571-8045475;BOGOTA D.C.;ceo@rab.global;RAB GLOBAL SAS;http://www.rab-global.com;Pabellón: 03, Nivel: 02, Stand: 409
RESORT TRAVEL CLUB;RESORT TRAVEL CLUB;SERVICIOS TURISTICOS;601-7454801;BOGOTA D.C.;gerencia@resorttravelclub.com.co;RESORT TRAVEL CLUB;http://www.resorttravelclub.com.co;Pabellón: 06, Nivel: 01, Stand: 240
RESORT TRAVEL CLUB;RESORT TRAVEL CLUB;servicios turísticos;601-7454801;BOGOTA D.C.;gerencia@resorttravelclub.com.co;RESORT TRAVEL CLUB;http://www.resorttravelclub.com.co;Pabellón: 11-16, Nivel: 01, Stand: 207
AGROEUROS;AGROEUROS;DERIVADOS DE CANNABIS MEDICINAL CBD, INFRAESTRUCTURA DE INVERNADERO Y ASESORIA EN PROYECTOS AGRICOLAS.;315-5603510;MEDELLIN;enigma-accesorios@hotmail.com;AGROEUROS;http://www.enigmajoyeria.com;Pabellón: 06, Nivel: 02, Stand: 109
STIHL;;;571-3603888;BOGOTA D.C.;nicholsonferreteria@hotmail.com;STIHLEn STIHL llevamos más de 90 años ayudando al crecimiento de las personas y de su labor. Por eso fabricamos las herramientas perfectas para cada ocasión, ya sea un largo día internado en la naturaleza o un trabajo casual del hogar. Estamos convencidos de que cuando cuentas con grandes aliados y equipos de calidad puedes crecer con mucha más fuerza.STIHL la fuerza para crecer;http://www.ferreterianicholson.co;Pabellón: 03, Nivel: 01, Stand: 514
SOMBREROS DON SAMUEL;SOMBREROS DON SAMUEL;PRODCUCCIÓN Y/O  COERCIALIIZACIÓN DE SOMBREROS, PONCHOS, CARRIELES, CAMISAS GUAYABERAS 	;310-5405367;MANIZALES;jsh985@hotmail.com;SOMBREROS DON SAMUEL;http://;Pabellón: 08, Nivel: 01, Stand: 302
MAS ORDEÑOS SAS;MAS ORDEÑOS SAS;EQUIPOS DE ORDEÑOS Y ESTRUCTURAS PARA ORDEÑOS ;571-8265076;FUNZA;mantenimientosordenos@gmail.com;MAS ORDEÑOS SAS;http://;Pabellón: 03, Nivel: 01, Stand: 128
COLIBRI HONEY BEE;COLIBRI HONEY BEE;miel y productos apícolas de la Sierra nevada de Santa Marta y de la Serrania del Cocuy;313-5268002;BOGOTA D.C.;Colibrihoneybee@gmail.com;COLIBRI HONEY BEE;http://;Pabellón: 06, Nivel: 01, Stand: 104
MARROQUINERIA DE COLOMBIA JR;MARROQUINERIA DE COLOMBIA JR;CORREAS, BILLETERAS, MONEDEROS TALLADOS,CHAQUETAS, RUANAS EN CUERO, CHAMARRAS,BOTAS,CALZDO EN CUERO, RAMAL, RIENDAS, SILLAS DE MONTAR;574-3879784;ENVIGADO;marroquineria-jr@hotmail.com;MARROQUINERIA DE COLOMBIA JR;http://;Pabellón: 08, Nivel: 01, Stand: 118
ROYAL PLUS TECHNOLOGIES S.A.S;;EQUIPOS DE BIOTECNOLOGIA PARA APLICACION EN MEDICINA VETERINARIA, PRODUCTOS DE INSEMINACION (ECOGRAFIA,RADIOLOGIA, LABORATORIO);571-8003401;BOGOTA D.C.;subgerente@royalplus.com.co;ROYAL PLUS TECHNOLOGIES S.A.S;http://;Pabellón: 03, Nivel: 02, Stand: 425
SAENZ FETY S.A.S.;;HORTALIZAS (TOMATES FRESCOS);571-6740055;BOGOTA D.C.;mslosada@saenzfety.com;SAENZ FETY S.A.S.Sáenz Fety es una compañía colombiana dedicada a la trasformación del agro en Colombia. Le apostó a que el país sea sostenible en pro de la reactivación económica, con un proyecto llamado AHORA*. Consiste en encontrar una respuesta sobre cómo alimentar al mundo sin dañar el planeta, por medio de cultivos, comercio y alimentación saludable que se traducen en una cadena feliz. Y por esto, trajo a Colombia un contenedor capaz de producir cultivos sanos, una excusa perfecta para reunir a todos los sectores y hablarle a la sociedad que es hora de sembrar local y comprar consciente.;http://www.saenzfety.com;Pabellón: ALB, Nivel: 01, Stand: 78
SAN FERMIN;SAN FERMIN;SILLA Y ACCESORIOS PARA MONTAR A CABALLO Y TODO LO RELACIONADO CON LA TALABARTERIA.;574-4482110;MEDELLIN;sanfermin@une.net.co;SAN FERMIN;http://www.talabarteriasanfermin.com;Pabellón: 08, Nivel: 01, Stand: 218
TALABARTERIA Y SOMBREROS DON LIBA;TALABARTERIA Y SOMBREROS DON LIBA;PARA ESTE AGRO EXPO LLEGAREMOS A COMERCIALIZAR SOMBREROS, ACCESORIOS EQUINOS Y GANADEROS Y ARTESANIAS PROPIAS DE NUESTRA REGION CARIBE Y DEL PAÍS.;575312-8979414;TURBACO;sanchezdehoyoslibardomanuel@gmail.com;TALABARTERIA Y SOMBREROS DON LIBA;http://;Pabellón: 08, Nivel: 01, Stand: 6
IAGROS;IAGROS;;571-8260858;FUNZA;alejandro.pecuario@gmail.com;IAGROS;http://;Pabellón: 03, Nivel: 01, Stand: 440
SARMIENTO GARCIA BIBIANA;;PRENDAS Y ACCESORIOS PARA MASCOTAS;;BOGOTA D.C.;bibi_arte@hotmail.com;SARMIENTO GARCIA BIBIANAropa personalizada y a la medida para mascotas;http://;Pabellón: 06, Nivel: 01, Stand: C102
SAVAKE COLOMBIA S.A.S.;;COMERCIALIZACION DE MAQUINARIA AGRICOLA Y FERRETERA CÓMO TALADROS, MOTOSIERRAS, GUADAÑAS, AHOYADORES, CORTACESPED, COMPRESORES, EMERILES, PULIDORAS, BOMBAS, GENERADORES, FUMIGADORAS ;571-5188181;BOGOTA D.C.;savakecolombia@savake.com.co;"SAVAKE COLOMBIA S.A.S.Somos una empresa colombiana, propiedad de un sólido grupo internacional con una larga trayectoria produciendo, importando y comercializando equipos a combustión, herramientas eléctricas y manuales; representando las marcas más importantes a nivel mundial para los sectores agrícola, construcción, ferretero e industria.Producimos y comercializamos equipos y productos con los más altos estándares de calidad a excelentes precios. Encuentra en Savake Colombia todo lo que necesites.";http://www.savake.com.co;Pabellón: 03, Nivel: 01, Stand: 602
AROMAS Y COLORES;AROMAS Y COLORES;LINEA DE HUMIDIFICADORES O DIFUSORES DE AROMAS;310-5524518;BOGOTA D.C.;vivianaseguraprieto@gmail.com;AROMAS Y COLORES;http://;Pabellón: 06, Nivel: 01, Stand: 214
ANDSEG;ANDSEG;PRODUCTO NATURAL SABILA, DIFUSORES DE AROMAS EN IMITACION MADERA, AFILADORES, LAMPARAS Y LINTERNAS RECARGABLES Y HERRAMIENTAS VARIAS;571-2241089;BOGOTA D.C.;comerandseg@hotmail.com;ANDSEG;http://;Pabellón: 06, Nivel: 01, Stand: 640
SERVICIOS DE MERCADOTECNIA S.A. DE C.V.;SERVICIOS DE MERCADOTECNIA S.A. DE C.V.;POMEGRANATE INDUSTRY SEMINARS;52777-3118533;CUERNAVACA;marco.albarran@imalinx.com;SERVICIOS DE MERCADOTECNIA S.A. DE C.V.;http://www.imalinx.com/es/;Pabellón: 06, Nivel: 02, Stand: 105
SOMBREROS FERRAN;SOMBREROS FERRAN;SOMBREROS, PONCHOS, RUANAS, RIENDAS Y APEROS;320-7055341;LA UNION;ferransilva1980@gmail.com;SOMBREROS FERRAN;http://;Pabellón: 08, Nivel: 01, Stand: 127
PROBOTS;PROBOTS;SERVICIOS DE SOFTWARE PARA MANEJO Y GERENCIA DE INFORMACIÓN PARA EL CAMPO COLOMBIANO;601-5035913;BOGOTA D.C.;development@probots.org;PROBOTS;http://www.probots.org;Pabellón: 06, Nivel: 01, Stand: 349
AGENCIA NACIONAL DE TIERRAS;AGENCIA NACIONAL DE TIERRAS;AGENCIA ESTATAL DE NATURALEZA ESPECIAL, DEL SECTOR DESCENTRALIZADO DE LA RAMA EJECUTIVA DE ORDEN NACIONAL;601-6352767;BOGOTA D.C.;mdiaz@sintonizarmedios.com;AGENCIA NACIONAL DE TIERRAS;http://;Pabellón: 03, Nivel: 01, Stand: 429
SOAGRO;SOAGRO;SELECTOR DE ARVENSES, SALADERO INTELIGENTE, ARO PROTECTOR PARA GUADAÑA, ARIETES HIDRÁULICOS, BASTÓN ABONADOR, RECOLECTOR DE FRUTAS DE ÁRBOL, RECOLECTOR DE FRUTAS DE PISO, RUANA PARA PLATEO, EMPALMADOR DE ALAMBRE, LENGÜETA RECOLECTORA DE CAFÉ, MATRACA, SEMBRADOR DE PASTO, TODO ESTO EN TODOS SUS TAMAÑOS Y PRESENTACIONES;312-6502153;MANIZALES;efi@soagro.net;SOAGRO;http://www.soagro.net;Pabellón: 06, Nivel: 01, Stand: 331
SOLBAÑOS S.A.S.;SOLBAÑOS S.A.S.;Unidades sanitarias portatiles V.I.P. piezas en fibra de vidrio energia solar, congeladores, entre otros.;571-4029644;BOGOTA D.C.;solbolanos2011@gmail.com;SOLBAÑOS S.A.S.;http://www.solbanossas.com;Pabellón: 03, Nivel: 02, Stand: 436
SOLBAÑOS S.A.S.;SOLBAÑOS S.A.S.;Unidades sanitarias portatiles V.I.P. piezas en fibra de vidrio energia solar, congeladores, entre otros.;571-4029644;BOGOTA D.C.;solbolanos2011@gmail.com;SOLBAÑOS S.A.S.;http://www.solbanossas.com;Pabellón: 03, Nivel: 01, Stand: 428
SOLUCIONES YMB SAS;SOLUCIONES YMB SAS;;;BOGOTA D.C.;gerenciaymb@gmail.com;SOLUCIONES YMB SAS;http://;Pabellón: 03, Nivel: 01, Stand: 108
SOLUCIONES YMB SAS;SOLUCIONES YMB SAS;MAQUINARIA PARA AGROINDUSTRIA;;BOGOTA D.C.;gerenciaymb@gmail.com;SOLUCIONES YMB SAS;http://;Pabellón: 03, Nivel: 01, Stand: 207
SOMOS TRES S.A.S;SOMOS TRES S.A.S;Agencia BTL ;318-8702326;BOGOTA D.C.;proyectos@somostres.com.co;SOMOS TRES S.A.S;http://www.somostres.com.co;Pabellón: 11-16, Nivel: 01, Stand: 110
TOVALNI - Articulos en Cuero;TOVALNI - Articulos en Cuero;MALETAS, MALETINES, BOLSOS, BILLETERAS, CINTURONES, SOMBREROS, CHAQUETAS, RUANAS, CHALES, PONCHOS,  MOCHILAS, MORRALES, MONEDEROS, PIELES, LINEA DE VIAJE Y MARROQUINERIA EN GENERAL.;571-2394937;BOGOTA D.C.;tovalini@hotmail.com;TOVALNI - Articulos en Cuero;http://;Pabellón: 08, Nivel: 01, Stand: 112
Ssangyong;Ssangyong;Camionetas 4x4;572-4851616;CALI;juan.mancera@ssangyong.com.co;Ssangyong;http://www.ssangyong.com.co;Pabellón: 06, Nivel: 01, Stand: 319
STEAK AND BEER;STEAK AND BEER;ASADORES TIPO BARRIL Y TODO TIPO DE ACCESORIOS PARA LOS MISMO;318-3989256;MEDELLIN;barrilessteakandbeer@gmail.com;STEAK AND BEER;http://www.barrilessteakandbeer.com;Pabellón: 06, Nivel: 02, Stand: 131
HIDROPURA TECNOLOGIA EN TRATAMIENTO DE AGUA;HIDROPURA TECNOLOGIA EN TRATAMIENTO DE AGUA;PLANTAS TRATAMIENTO DE AGUA , TANQUES, ESTRUCTURALES, DISPENSADORES, EQUIPOS LUZ ULTRAVIOLETA, EQUIPO ULTRAFILTRACION, EQUIPOS DE PUFIRICACION PARA TIENDAS DE AGUA , TRATAMIENTO DE AGUA PARA CONSUMO ANIMAL, TRATAMIENTO PARA RIEGO DE CULTIVOS ,PLANTAS ENVASADORAS DE AGUA;601-8832150;CAJICA;gerenciahidropura@gmail.com;HIDROPURA TECNOLOGIA EN TRATAMIENTO DE AGUA;http://;Pabellón: 06, Nivel: 01, Stand: 644
SUAREZ TRIANA BENILDA ALEJANDRA;SUAREZ TRIANA BENILDA ALEJANDRA;Productos apícolas, y fusiones de miel de abejas con frutas y especias;319-3809111;BOGOTA D.C.;contacto@rutadelamiel.com;SUAREZ TRIANA BENILDA ALEJANDRA;http://;Pabellón: 06, Nivel: 01, Stand: VACIO 2
SUKUP MANUFACTURING CO;SUKUP MANUFACTURING CO;SILOS, SECADORES Y MECANIZACIONES PARA EL MANEJO DEL GRANO;1641-8924242;SHEFFIELD;info@sukup.com;SUKUP MANUFACTURING CO;http://www.sukup.com;Pabellón: 06, Nivel: 01, Stand: 213
SUMYCOM LTDA;SUMYCOM LTDA;HERRAMIENTA DE CORTE EN ALTURA, TIJERAS DE PODA, RECOLECTORES Y SIERRAS MANUALES;571-2250439;BOGOTA D.C.;mercadeo.sumycom@gmail.com;SUMYCOM LTDA;http://www.sumycom.com;Pabellón: 06, Nivel: 01, Stand: 109
AGROPULI TIERRA DE DIATOMEAS;;;571-9260005;BOGOTA D.C.;suplementosagropuli@gmail.com;AGROPULI TIERRA DE DIATOMEASEMPRESA COLOMBIANA DEDICADA A LA PRODUCCION Y COMERCIALIZACION DE ENMIENDAS AGRÍCOLAS COMO TIERRA DE DIATOMEAS Y HUMUS, PARA SU APLICACIÓN EN TODO TIPO DE CULTIVOS, COMO UN PRODUCTO QUE MEJORA LAS CONDICIONES DEL SUELO Y ASI MISMO LA NUTRICIÓN Y LA PROTECCIÓN DE LA PLANTA, ASISTENCIA TÉCNICA A NIVEL NACIONAL.;http://www.agropuli.com.co;Pabellón: 06, Nivel: 02, Stand: 133
TALLER DEL GANADERO SAS;TALLER DEL GANADERO SAS;BRETE, BRETE BÁSCULA, BRETE PARA TERNEROS, CORRALES PARA GANADERIA, PARTIDOR DE VAQUERÍA;313-2943845;VILLAVICENCIO;produccion.tallerg@gmail.com;TALLER DEL GANADERO SAS;http://www.tallerdelganadero.com;Pabellón: 03, Nivel: 01, Stand: 519
CAMPEON AGROPECUARIO;;VENTA Y EXHIBICION DE MEDICAMENTOS VETERINARIOS, BIOLOGICOS Y PRODUCTOS DE INSEMINACION PORCICULTURA;571-7427405;BOGOTA D.C.;gerencia@campeonagropecuario.com;CAMPEON AGROPECUARIOCAMPEON AGROPECUARIOVenta de medicamentos, productos de desinfección, concentrado, vacunas, implementos de inseminación y todo lo relacionado con porcicultura.Asesoría  especializada, planes preventivos y buenas practicas en Porcicultura.		;http://www.campeonagropecuario.com;Pabellón: 03, Nivel: 02, Stand: 506
COMERCIALIZADORA SAT;COMERCIALIZADORA SAT;PROCESADORES DE ALIMENTOS, DIFUSORES DE AROMA Y AMBIENTADORES, HERRAMIENTAS PARA CAMPO;301-7882557;BOGOTA D.C.;stejedoravila@gmail.com;COMERCIALIZADORA SAT;http://;Pabellón: 06, Nivel: 01, Stand: 621
COMERCIALIZADORA SAT;COMERCIALIZADORA SAT;PROCESADORES DE ALIMENTOS, DIFUSORES DE AROMA Y AMBIENTADORES, HERRAMIENTAS PARA CAMPO;301-7882557;BOGOTA D.C.;stejedoravila@gmail.com;COMERCIALIZADORA SAT;http://;Pabellón: 06, Nivel: 01, Stand: 614
TEJIDOS SINTETICOS DE COLOMBIA S.A.;;1. Malla tejido Raschel en polietileno de alta densidad virgen con estabilizador U.V. 2. Pantalla termo-reflectiva en tejido Raschel de polietileno de alta densidad recubierta con aluminio por ambas caras.3. Hilos y cordele, fibrilados en polipropileno virgen o en material recuperado post-industria.4. Sogas - Cuerdas retorcidas en rafia fibrilada de polipropileno virgen o en material recuperado post-industria.5. Fibras sintéticas de polipropileno virgen.;577-6760101;BOGOTA D.C.;marketing@tesicol.com.co;TEJIDOS SINTETICOS DE COLOMBIA S.A.Es la industria colombiana líder en la fabricación de productos especializados en dar soluciones de sombrío y cerramiento bajo la marca Polisombra®, además de la fabricación de medios de unión y fijación con su amplia línea de cordeles, hilos y sogas, para el uso agroindustrial y doméstico.;http://www.tesicol.com.co/;Pabellón: 03, Nivel: 01, Stand: 327
TERRAGRO;;ATOMIZADORA DE ARRASTRE DE 600 LITROS ENSAMBLADA EN COLOMBIA CON CHASIS EN ACERO INOXIDABLE, BOMBA DE DIAFRAGMA, TANQUE CURVO DE POLIPROPILENO Y VENTILADOR CON CAJA DE TRANSMISION DE POTENCIA. FUMIGADORAS MANUALES DE MOCHILA , SERIE DE RESPUESTOS DE NUESTROS PRODUCTOS;311-3129494;GINEBRA;gsatizabal@terragro.com.co;TERRAGROCONSTRUCCION DE EQUIPOS DE FUMIGACION ASISTIDOS POR AIRE (ATOMIZADORA) PARA CONTROL FITOSANITARIO EN CULTIVOS DE FRUTALES;http://;Pabellón: 06, Nivel: 01, Stand: 638
TIERRACOL;;Productos alimenticios transformados de productores del campo;317-3050283;BOGOTA D.C.;info@tierramia.com.co;TIERRACOLLINEA cosmetica capilr organica;http://;Pabellón: 06, Nivel: 01, Stand: G440
LOS TORRES HORNO Y PARRILLA;LOS TORRES HORNO Y PARRILLA;TERNERA AL HORNO, COSTILLA DE CERDO AL HORNO, LOMO A LA PLANCHA, PARRILLADA, CHORIZO, MORCILLA, CORTES DE CARNE DE RES, CEVICHES;315-3247944;BOGOTA D.C.;samisa97@hotmail.com;LOS TORRES HORNO Y PARRILLA;http://;Pabellón: AL02, Nivel: 01, Stand: 3
TRACTOGERMANA AGROCENTER;TRACTOGERMANA AGROCENTER;TRACTORES, COSECHADORAS TRILLADORAS, COMBINADAS, IMPLEMENTOS AGRICOLAS, EQUIPOS DE FORRAJE Y HENO, MOTOCULTORES Y MOTOAZADAS, LUBRICANTES, REPUESTOS, SERVICIO TECNICO;571-6292720;BOGOTA D.C.;gerencia@tractogermana.com;TRACTOGERMANA AGROCENTER;http://www.tractogermana.com;Pabellón: 11-16, Nivel: 01, Stand: 124
TRACTOGERMANA AGROCENTER;TRACTOGERMANA AGROCENTER;TRACTORES, COSECHADORAS TRILLADORAS, COMBINADAS, IMPLEMENTOS AGRICOLAS, EQUIPOS DE FORRAJE Y HENO, MOTOCULTORES Y MOTOAZADAS, LUBRICANTES, REPUESTOS, SERVICIO TECNICO;571-6292720;BOGOTA D.C.;gerencia@tractogermana.com;TRACTOGERMANA AGROCENTER;http://www.tractogermana.com;Pabellón: 11-16, Nivel: 01, Stand: 223
TQI. SAS;TQI. SAS;BIOCATALIZADORES para tratamiento de desechos organicos y tratamiento de aguas. ECOSYSTEM PLUS,;572-6959567;YUMBO;cristina.quintero@tqi.co;TQI. SAS;http://www.tqi.co;Pabellón: 06, Nivel: 01, Stand: 141
ARTESANÍAS MEXICANAS;ARTESANÍAS MEXICANAS;CERÁMICA DE ALTO RELIEVE PINTADA A MANO, ARTÍCULOS RELIGIOSOS Y DECORATIVOS;311-4658720;CHIA;ekbalamarte@gmail.com;ARTESANÍAS MEXICANAS;http://;Pabellón: 08, Nivel: 01, Stand: 313
TRISAL;TRISAL;;3493-7336741;TERRASSA;gerard@trisal.com;TRISAL;http://www.trisal.com;Pabellón: 03, Nivel: 01, Stand: 228
FEDERACIÓN COLOMBIANA DE GANADEROS - FEDEGAN;;LA FEDERACIÓN COLOMBIANA DE GANADEROS FEDEGÁN ES UNA ORGANIZACIÓN GREMIAL SIN ÁNIMO DE LUCRO, EN SU CONDICIÓN DE GREMIO CÚPULA DE LA GANADERÍA COLOMBIANA, FEDEGÁN AGRUPA, EN CALIDAD DE AFILIADAS, A LAS ORGANIZACIONES GREMIALES GANADERAS REGIONALES Y LOCALES, COMO TAMBIÉN A OTRO TIPO DE ENTIDADES VINCULADAS A LA ACTIVIDAD GANADERA NACIONAL.  TVGAN: UN PROGRAMA DE TELEVISIÓN TRANSMITIDO POR TV AGRO, EL ÚNICO CANAL EN COLOMBIA ESPECIALIZADO EN LA PRODUCCIÓN AGROPECUARIA CON AMPLIA COBERTURA A NIVEL NACIONAL E INTERNACIONAL. DONDE COMERCIALIZAMOS : PRODUCTO, GANADOS Y PUBLICIDAD. FUNDAGAN: EMPRENDIÓ EL CAMINO DEL ACOMPAÑAMIENTO Y DEL RECONOCIMIENTO PARA LA REPARACIÓN A NUESTRAS VÍCTIMAS GANADERAS DE LA VIOLENCIA. NUESTRO COMPROMISO CON LA RECONCILIACIÓN ES TRABAJAR POR EL DERECHO A LA VERDAD Y LA JUSTICIA. USANDO COMO MARCO LA LEY DE VÍCTIMAS Y RESTITUCIÓN DE TIERRAS (LEY 1448 DE 2011), HEMOS REALIZADO OCHO JORNADAS DE ASESORÍA Y ACOMPAÑAMIENTO EN DIEZ CIUDADES DEL PAÍS: FLORENCIA, MONTERÍA, VALLEDUPAR, BARRANCABERMEJA, PEREIRA, SAN JUAN DEL CESAR, CHIGORODÓ, BARRANQUILLA, VILLAVICENCIO Y POPAYÁN. EN ELLAS LOS GANADEROS ENCUENTRAN UN RESPALDO GREMIAL Y OBTIENEN DE MANERA GRATUITA ASESORÍA, SEGUIMIENTO Y ACOMPAÑAMIENTO PARA ACCEDER EXITOSAMENTE A LOS DERECHOS QUE LES CONCEDE DICHA LEY. ALMAGAN:  ES QUE SU PORTAL HTTPS://ALMAGAN.CO/ DONDE LOS DIFERENTES AGRICULTORES Y GANADEROS PUEDAN ADQUIRIR LOS PRODUCTOS E INSUMOS DE EXCELENTE CALIDAD Y A LOS MEJORES PRECIOS DEL MERCADO. UNA DE LAS PRINCIPALES ESTRATEGIAS DEL PORTAL ES OFRECER CONSTANTEMENTE PROMOCIONES QUE PERMITAN UN MAYOR AHORRO A LOS GANADEROS Y UNA CONSTANTE DISPONIBILIDAD DE PRODUCTOS GRACIAS AL APOYO LOGÍSTICO DE NUESTROS PROVEEDORES Y, EN OTROS CASOS, DE NUESTRO PROPIO OPERADOR. EMBRIOGAN FEDEGÁN HA PUESTO EN SU PÁGINA WEB, EL ACCESO AL PROGRAMA EMBRIOGAN, PARA QUE LOS GANADEROS INTERESADOS SE VINCULEN AL PROGRAMA DE MEJORAMIENTO GENÉTICO, Y LOS ACERCARÁ AL GREMIO. CONTEXTO GANADERO: ES UN DIARIO DIGITAL.;601-5782020;BOGOTA D.C.;mcgutierrez@fedegan.org.co;FEDERACIÓN COLOMBIANA DE GANADEROS - FEDEGANLa Federación Colombiana de Ganaderos FEDEGÁN es una organización gremial sin ánimo de lucro, En su condición de gremio cúpula de la ganadería colombiana, FEDEGÁN agrupa, en calidad de afiliadas, a las organizaciones gremiales ganaderas regionales y locales, como también a otro tipo de entidades vinculadas a la actividad ganadera nacional. ;http://www.tvgan.com.co;Pabellón: 03, Nivel: 02, Stand: 202
U.S. LIVESTOCK GENETICS EXPORT, INC;U.S. LIVESTOCK GENETICS EXPORT, INC;;160-8437202;MOUNT HOREB;msieber@uslge.org;U.S. LIVESTOCK GENETICS EXPORT, INC;http://www.uslge.org;Pabellón: 03, Nivel: 02, Stand: G412
UNIDAD ADMINISTRATIVA ESPECIAL DE GESTION DE RESTITUCION DE TIERRAS DESPOJADAS;UNIDAD ADMINISTRATIVA ESPECIAL DE GESTION DE RESTITUCION DE TIERRAS DESPOJADAS;;601-3770300;BOGOTA D.C.;milton.paternina@restituciondetierras.gov.co;UNIDAD ADMINISTRATIVA ESPECIAL DE GESTION DE RESTITUCION DE TIERRAS DESPOJADAS;http://www.restituciondetierras.gov.co;Pabellón: 03, Nivel: 01, Stand: 326
UNAGA;UNAGA;;571-6161387;BOGOTA D.C.;info@unaga.org.co;UNAGA;http://www.unaga.org.co;Pabellón: 11-16, Nivel: 01, Stand: 1004
U.T. AGROSOCIAL2020;U.T. AGROSOCIAL2020;FRUTOS DE LA FRESA ;57-2025060;POPAYAN;coordinacionhac@gmail.com;U.T. AGROSOCIAL2020;http://;Pabellón: 06, Nivel: 02, Stand: 145
AGROPANELA DEL CAUCA S.A.S;AGROPANELA DEL CAUCA S.A.S;PANELA DIFERENTES PRESENTACIONES, EN BLOQUE ,PULVERIZADA, SABORIZADA, PRODUCTOS DERIVADOS DE CAÑA COMO MIEL, BEBIDAS, CONFITERIA, PANADERIA ETC. ;300-3221344;POPAYAN;rafapatino@misena.edu.co;AGROPANELA DEL CAUCA S.A.S;http://;Pabellón: 06, Nivel: 02, Stand: 147
UNIVERSIDAD DE LA SALLE COLOMBIA;UNIVERSIDAD DE LA SALLE COLOMBIA;PRESENTACIÓN DE PROGRAMAS DE PREGRADO, POSTGRADO, SERVICIOS DE EDUCACIÓN Y CONSULTORIA DE LA FACULTAD DE CIENCIAS AGROPECUARIAS.PROMOCIÓN DE LOS SERVICIOS DE LA CLÍNICA VETERINARIA EN GRANDES ANIMALES.;571-6772699;BOGOTA D.C.;ccabra@lasalle.edu.co;UNIVERSIDAD DE LA SALLE COLOMBIA;http://www.lasalle.edu.co;Pabellón: 03, Nivel: 02, Stand: 302
UNIVERSIDAD NACIONAL DE COLOMBIA;;Servicios: formación, innvestigación y extensión de la Universidad Nacional de Colombia. Productos: derivados del quehacer educativo, producciones editoriales y relacionados con la tienda universitaria como libretas, recordatorios, paños para lentes, entre otros. ;3-1650000;BOGOTA D.C.;jdmateush@unal.edu.co;UNIVERSIDAD NACIONAL DE COLOMBIASomos la universidad de la nación, el proyecto cultural, científico y colectivo del país con 154 años de trayectoria y presencia en 9 sedes de alcance nacional. Contamos con más de 900 grupos de investigación en todas las áreas del conocimiento. Además de la reconocida educación superior que se imparte en pregrados y posgrados, somos referente en la prestación de servicios como asesorías y consultorías, pruebas y desarrollos en laboratorio, cursos y capacitaciones, extensión solidaria y en general todo proceso de transferencia de conocimiento por el cual se hacen partícipes de los beneficios de su actividad académica e investigativa a los sectores productivos, sociales, culturales y políticos que conforman la nación colombiana.;http://www.unal.edu.co;Pabellón: 03, Nivel: 02, Stand: 102
BORDADOS RUBY DE CARTAGO;BORDADOS RUBY DE CARTAGO;GUAYABERAS, BORDADAS, PONCHOS Y PANTALONES;2139163;CARTAGO;bordadosruby@hotmail.com;BORDADOS RUBY DE CARTAGO;http://;Pabellón: 08, Nivel: 01, Stand: 325
VER DE CAMPO SAS;VER DE CAMPO SAS;Infusiones herbales 1. Moringa y granada 2. Flor de jamaica y aràndanos 3. Menta, limòn y jengibre ;350-6615435;BOGOTA D.C.;gerencia@verdecampocolombia.com;VER DE CAMPO SAS;http://;Pabellón: 06, Nivel: 01, Stand: 106
VERMORA SAS;VERMORA SAS;;322-6513408;BOGOTA D.C.;contacto@vermorasas.com;VERMORA SAS;http://;Pabellón: 06, Nivel: 01, Stand: 224
VERYEL S.A.S;VERYEL S.A.S;Alimento natural deshidratado, snacks deshidratadors y productos congelados (helados);322-2124052;BOGOTA D.C.;veryel.info@gmail.com;VERYEL S.A.S;http://www.veryel.com.co;Pabellón: 06, Nivel: 01, Stand: 108
VETCO SUPPLY;VETCO SUPPLY;JERINGAS(BOVINO, EQUINO, PORCINO,OVINO, CAPRINO, CANINO, FELINO Y AVES)AGUJAS(BOVINO, EQUINO, PORCINO, OVINO, CAPRINO, CANINO, FELINO Y AVES)TOPICOS(EQUINO, CAPRINO, OVINO Y BOVINO)QUIRURGICO(BOVINO, EQUINO, PORCINO,OVINO, CAPRINO, CANINO, FELINO Y AVES)CONTROL DE IDENTIFICACION(BOVINO, EQUINO, PORCINO, OVINO Y CAPRINO)CASTRACION (BOVINO, EQUINO, PORCINO, CAPRINO Y OVINO)DESCOME(BOVINO, CAPRINO Y OVINO)ALIMENTACION(BOVINO, EQUINO, PORCINO CAPRINO Y OVINO)INSEMINACION Y REPRODUCCION(BOVINO, EQUINO, PORCINO, OVINO Y CAPRINO)INSTRUMENTOS VETERINARIOS(BOVINO, EQUINO, PORCINO, OVINO, CAPRINO, CANINO, FELINO, AVES Y APICOLA)MASCOTAS(CANINO, FELINO Y CUNICOLA);575-3397918;BARRANQUILLA;carlos.restrepo@ecc.com.co;VETCO SUPPLY;http://www.vetco-supply.com;Pabellón: 03, Nivel: 02, Stand: 326
VETIPLUS S.A. Su alidado estrategico;VETIPLUS S.A. Su alidado estrategico;REALIZACIÓN DE PROCESO DE DESINFECCIÓN DE INGRESO Y SALIDA DE VEHÍCULOS, ADEMAS DE LOS SITOS CON PRESECIA DE ANIMALES EN LOS PABELLONES;601-7434066;BOGOTA D.C.;logistica@vetiplus.com;VETIPLUS S.A. Su alidado estrategico;http://www.vetiplus.com;Pabellón: 06, Nivel: 01, Stand: 120
GINNAS BOOTS;GINNAS BOOTS;"Botas  100 % cuero  de  mujer  y  de  hombre  tipo  equitacion, texana, y  de  moda  Nacional  diseños  y  colores  surtidos : Suaceño, Peruano; Aguadeño,Vueltiao, sombrero  de  tela  procesada, artequino  tipo montador, fieltro, ecuatoriano, reebelde, costeño  hormado, llaveros,  cintas  para  somreeros, cintas  de  mostacilla, sombrero  panama hats,  sombrero de  cuero,  ponchos,  muleras, zarape, ruanas,  pines, gorras, carrieles, todo  lo  relacionado  con  talanarteria, sombrero  sandoneño																																																																											";311-4916992;BOGOTA D.C.;ginnasboots@yahoo.com;GINNAS BOOTS;http://;Pabellón: 08, Nivel: 01, Stand: 305
VIRBAC COLOMBIA LTDA;VIRBAC COLOMBIA LTDA;;571-2252100;BOGOTA D.C.;fabian.escobar@virbac.com.mx;VIRBAC COLOMBIA LTDA;http://www.co.virbac.com;Pabellón: 11-16, Nivel: 01, Stand: 127
VITA IVF LAB SAS;VITA IVF LAB SAS;BIOTECNOLOGIA BOVINA  IN VITRO, PRODUCCIÓN DE EMBRIONES FRESCOS, PRODUCCIÓN DE EMBRIONES CONGELADOS DT, PRODUCCIÓN DE EMBRIONES FRESCOS TRANSFERIDOS;571-5970620;BOGOTA D.C.;ceo@vitaivflab.com;VITA IVF LAB SAS;http://;Pabellón: 03, Nivel: 02, Stand: 310
WHGM GUTSUA GROUP;WHGM GUTSUA GROUP;PRODUCTOS PARA MASCOTAS FABRICADOS EN MADERA, TALES COMO COMEDEROS, CAMAS, ARENERAS Y ACCESORIOS;571-3860229;BOGOTA D.C.;gutsuagroup@gmail.com;WHGM GUTSUA GROUP;http://;Pabellón: 06, Nivel: 01, Stand: 201
WORLD VISION INTERNACIONAL VISION MUNDIAL INTERNACIONAL;WORLD VISION INTERNACIONAL VISION MUNDIAL INTERNACIONAL;Servicios sociales y de utilidad comun que se ofrecen bajo el financiemiento de programas de patrocinio de niños y niñas mas vulnerables. ;571-3487171;BOGOTA D.C.;juridica_colombia@wvi.org;WORLD VISION INTERNACIONAL VISION MUNDIAL INTERNACIONAL;http://www.worldvision.co;Pabellón: 03, Nivel: 01, Stand: 115
ZETTAPP;ZETTAPP;;;BOGOTA D.C.;zettapp.imp@gmail.com;ZETTAPP;http://;Pabellón: 03, Nivel: 01, Stand: 634
ACG EQUIPOS S.A.S;;CAÑON ESPANTAPAJAROS A GAS, GUADAÑADORAS, MOTOBOMBAS ;571-2186881;BOGOTA D.C.;gerencia@acgequipos.com.co;ACG EQUIPOS S.A.SCañon Espantapajaros;http://www.acgequipos.com.co;Pabellón: 03, Nivel: 01, Stand: 230
ACOVASAL - AGROSUECO;ACOVASAL - AGROSUECO;;;BOGOTA D.C.;decorlenz@yahoo.es;ACOVASAL - AGROSUECO;http://;Pabellón: 03, Nivel: 01, Stand: 539
PASTOR;PASTOR;Productos para el control de vectores (mosquitos) que afectan la salud de los trabajadores, para aplicación en piel y en ropa (indumentaria, uniformes).Prevención de Dengue, Malaria, Leishmaniasis entre otros.;571-8829266;ZIPAQUIRA;sergio.hernandez@pastor.com.co;PASTOR;http://www.pastor.com.co;Pabellón: 06, Nivel: 01, Stand: 610
